player,position,nation,acquisition_fee_usd_m,acquired_from,acquisition_season,status_2023_24,career_total_apps,career_total_goals
Cabral,Striker (C),Brazil,21.5,Fiorentina,2023/24,First season at Benfica,192,84
Florentino,Defensive Midfielder,Portugal,0,Benfica Academy,,Established starter (homegrown),182,3
Rollheiser,Attacking Midfielder (R/L/C),Argentina,10.25,Estudiantes,2024/25 (permanent; on loan 2023/24),On loan at Benfica from Estudiantes,101,9
Aguirre,Defender (R)/D(L)/M(R),Argentina,8,Lanus,2023/24,First season at Benfica,115,5
Jurasek,Defender (L)/WB(L),Czechia,15,Slavia Prague,2023/24,Signed by Benfica then loaned to TSG Hoffenheim,112,9
